{
  "id": "c45_writing_medium",
  "title": "Telefoninterview-Termin vereinbaren",
  "rootTitle": "plan for appointment call setup",
  "category": "Writing",
  "totalPairs": 6,
  "dialogue": [
    {
      "pair": 1,
      "speaker": "user",
      "text": "asking josepha and asking to confirm when we are planning for the appointment call timing and to confirm\n## **Deine Bewerbung (Your application)**\n**Inbox**\nPersonio SE & Co. KG\n| |\n| :- |\n| |\n| - |\n### Josepha Maack \\<pawlik-jobs\\@m.personio.de>\n###\n| Sep 4, 2026, 3:53 PM (3 days ago) | | |\n| --------------------------------: | -: | -: |\n| | | |\n| to me | [image](https://mail.google.com/mail/u/0/images/cleardot.gif) |\n| ----- | ------------------------------------------------------------- |\nsvg\n**Translated: GermansvgEnglish**\nTranslate can make mistakes, so verify translations\nHello Jayon,\nThank you very much for your application.\nSince your application documents made a positive impression, my colleague Felix would like to get to know you better in a short phone call.\nWould you have time for a call next Monday or Tuesday?\nYou can also contact me at [(+49 170 3730238](tel:+49%20170%203730238) ) so that we can arrange an alternative appointment.\nI look forward to your feedback.\nBest regards\nJosepha\nSenior HR Manager\n\nPawlik Consultants GmbH\nASTRATOWER\n[Circus Way 2](https://www.google.com/maps/search/Zirkusweg+2+20359+Hamburg?entry=gmail\\&source=g)\n[20359 Hamburg](https://www.google.com/maps/search/Zirkusweg+2+20359+Hamburg?entry=gmail\\&source=g)\nPhone [+49 40 532850 523](tel:+49%2040%20532850523)\nMobile [+49 170 3730238](tel:+49%20170%203730238)\nFax [+49 40 532850 10](tel:+49%2040%2053285010)\nEmail: [[jmaack@pawlik.de](mailto:jmaack@pawlik.de)](mailto\\:[jmaack@pawlik.de](mailto:jmaack@pawlik.de))\nWeb [[www.pawlik-group.com](](http://www.pawlik-group.com](/)http://www.pawlik-group.com/)",
      "attachments": [],
      "ts": "2026-09-07T09:00:07.561999Z"
    },
    {
      "pair": 1,
      "speaker": "ai",
      "text": "Since Josepha's asking whether Monday or Tuesday works, I need your preference before I can draft the confirmation.",
      "attachments": [],
      "ts": "2026-09-07T09:00:11.371563Z"
    },
    {
      "pair": 2,
      "speaker": "user",
      "text": "Q: Which day works for the call?\nA: i a, fine with both i alrady send a mail on friday saying i am free on modany and tuesday from 9 am and wouldbe avialle but todya i am wain gfor the time now\n\nQ: Roughly what time?\nA: Morning",
      "attachments": [],
      "ts": "2026-09-07T09:00:53.963924Z"
    },
    {
      "pair": 2,
      "speaker": "ai",
      "text": "That should nudge her to send the exact time since you already gave your availability Friday.",
      "attachments": [],
      "ts": "2026-09-07T09:01:02.867528Z"
    },
    {
      "pair": 3,
      "speaker": "user",
      "text": "73 of 13,104\nDeine Bewerbung (Your application)\nInbox\nJosepha Maack <pawlik-jobs@m.personio.de>\nSep 4, 2026, 3:53 PM (3 days ago)\nto me\nTranslated: German\nEnglish\nTranslate can make mistakes, so verify translations\nHello Jayon,\nThank you very much for your application.\nSince your application documents made a positive impression, my colleague Felix would like to get to know you better in a short phone call.\nWould you have time for a call next Monday or Tuesday?\nYou can also contact me at (+49 170 3730238 ) so that we can arrange an alternative appointment.\nI look forward to your feedback.\nBest regards\nJosepha\nSenior HR Manager\nPawlik Consultants GmbH\nASTRATOWER\nCircus Way 2\n20359 Hamburg\nPhone +49 40 532850 523\nMobile +49 170 3730238\nFax +49 40 532850 10\nEmail: jmaack@pawlik.de\nWeb [www.pawlik-group.com](https://www.pawlik-group.com)\nVAT ID: DE118672991 - Commercial Register: Hamburg District Court HRB 126200 - Managing Directors: Joachim Pawlik, Layla Dolfen\nThis email and all attachments contain confidential and/or legally privileged information. If you are not the intended recipient or have received this email in error, please notify the sender immediately and delete this email and its contents. Unauthorized copying or distribution of this email is prohibited.\nThis e-mail and any attached files may contain confidential and/or privileged information. If you are not the intended recipient (or have received this e-mail by mistake) please notify the sender immediately and delete this e-mail. Any unauthorized duplication, disclosure or distribution of this e-mail and content is strictly forbidden.\n______________________\n“Information on data processing pursuant to Art. 13 GDPR: https://www.pawlik-consultants.de/kontakt/datenschutzerklaerung”\njayon k vinod <jayonkv137@gmail.com>\nSep 4, 2026, 4:41 PM (3 days ago)\nto Josepha\nHello Josepha\nVielen Dank für Ihre Rückmeldung.\nIch bin am Montag oder Dienstagvormittag ab 9:00 Uhr für ein Gespräch verfügbar.\nBitte lassen Sie mich wissen, welche Uhrzeit für Sie am besten passt. Könnten Sie mir auch kurz sagen, ob das Gespräch telefonisch oder über Microsoft Teams stattfindet?\nViele Grüße\nJayon K. Vinod",
      "attachments": [],
      "ts": "2026-09-07T09:01:18.559974Z"
    },
    {
      "pair": 3,
      "speaker": "ai",
      "text": "Since your first email was in German, I'll follow up in German too.\n\nShort nudge asking if there's a confirmed time yet, since you're still free from 9 AM today and tomorrow.",
      "attachments": [],
      "ts": "2026-09-07T09:01:25.041390Z"
    },
    {
      "pair": 4,
      "speaker": "user",
      "text": "no now should i call and ask them today is it too early for that",
      "attachments": [],
      "ts": "2026-09-07T09:01:43.374792Z"
    },
    {
      "pair": 4,
      "speaker": "ai",
      "text": "Not too early — she gave you her mobile number specifically so you could sort out timing directly, and today is one of the two days she suggested. German business hours typically start around 9 AM, so if it's past that, calling now is completely fine. If it's earlier than 9, worth waiting a bit so you're not catching her before her day starts.\n\nA quick tip: have your intro ready — something like \"Guten Tag Frau Maack, hier ist Jayon Vinod, ich habe mich letzte Woche beworben und wollte kurz einen Termin für das Gespräch mit Felix abstimmen.\" Keeps it short and gets straight to why you're calling.",
      "attachments": [],
      "ts": "2026-09-07T09:01:49.124834Z"
    },
    {
      "pair": 5,
      "speaker": "user",
      "text": "give me th efull convoeration that i should be speaking in gemrnay so i can confidently intouce myself slowly and ask for the slot for the appointment",
      "attachments": [],
      "ts": "2026-09-07T09:02:26.590035Z"
    },
    {
      "pair": 5,
      "speaker": "ai",
      "text": "Here's a phone script — English line first so you know what you're saying, German right after. Read it slowly, no rush.\n\n---\n\n**1. Opening**\n\"Good day, this is...\"\n*Guten Tag, hier ist Jayon Vinod.*\n\n**2. State why you're calling**\n\"I applied last week and spoke with Josepha by email about an interview appointment.\"\n*Ich habe mich letzte Woche beworben und mit Josepha per E-Mail über einen Gesprächstermin geschrieben.*\n\n**3. Ask if you're speaking with the right person / ask for Josepha**\n\"Am I speaking with Josepha Maack?\" (if she picks up)\n*Spreche ich mit Josepha Maack?*\n\nor if someone else answers:\n\n\"Could I speak with Josepha Maack, please?\"\n*Könnte ich bitte mit Josepha Maack sprechen?*\n\n**4. Get to the point — ask for the slot**\n\"I'm available today and tomorrow from 9 AM. Could we arrange a specific time for the call with Felix?\"\n*Ich bin heute und morgen ab 9 Uhr verfügbar. Können wir eine genaue Uhrzeit für das Gespräch mit Felix vereinbaren?*\n\n**5. If she gives a time, confirm it back**\n\"So [time] o'clock, is that correct?\"\n*Also um [Uhrzeit] Uhr, ist das richtig?*\n\n**6. Ask phone or Teams**\n\"Will the call be by phone or via Microsoft Teams?\"\n*Findet das Gespräch telefonisch oder über Microsoft Teams statt?*\n\n**7. Close politely**\n\"Thank you very much, I look forward to it. Have a nice day.\"\n*Vielen Dank, ich freue mich darauf. Ihnen noch einen schönen Tag.*\n\n---\n\nA few things worth knowing before you dial: she may speak fast — if so you can say *\"Könnten Sie das bitte etwas langsamer wiederholen?\"* (Could you repeat that a bit slower, please?). And numbers/times are the part most likely to trip you up, so if she says a time you don't catch clearly, just ask her to repeat it rather than guessing.",
      "attachments": [],
      "ts": "2026-09-07T09:02:37.779488Z"
    },
    {
      "pair": 6,
      "speaker": "user",
      "text": "no no i am goona talk to jsoepha its her numebr she send and for booking the call tiing i can call her",
      "attachments": [],
      "ts": "2026-09-07T09:03:41.058495Z"
    },
    {
      "pair": 6,
      "speaker": "ai",